{
  "record_id": "GAP-SEMANTIC-0001",
  "name": "Protocolo real do SIGIL_SOCKET",
  "family": "runtime",
  "artifact_type": "token_vazio",
  "nature": "lacuna operacional conhecida",
  "status": "gap",
  "origin": {
    "source_type": "github",
    "source_ref": "RAFAELIA_CORE/SIGIL_SOCKET",
    "author": "Rafael Melo Reis",
    "captured_at": "2026-07-09T21:00:00-03:00"
  },
  "evidence": [{
    "evidence_id": "EV-SOCKET-INDEX-0001",
    "level": "indexed",
    "source_ref": "índices e logs que citam .verbo.sock"
  }],
  "risk": {
    "level": "high",
    "description": "Executar um canal reativo sem conhecer protocolo, payload e permissões.",
    "controls": ["não executar", "abrir scripts", "testar somente em sandbox"]
  },
  "relations": [
    {"target_id": "SIGIL_SOCKET", "relation_type": "depends_on", "weight": 0.8},
    {"target_id": "OMEGA-GOV", "relation_type": "requires_review", "weight": 1.0}
  ],
  "next_action": "abrir socket_listen.sh, guard_socket.sh e verbo_socket_server.sh; documentar protocolo e ACL",
  "execution_gate": "blocked",
  "token_vazio_reason": "o corpo dos scripts e o protocolo de transporte ainda não foram validados",
  "use_policy": {"privacy": "private", "training_eligibility": "no", "retention": "archive", "purpose": "audit", "owner": "user"},
  "created_at": "2026-07-09T21:00:00-03:00",
  "updated_at": "2026-07-09T21:00:00-03:00"
}
